{
  "$schema":"https://json-schema.org/draft/2020-12/schema",
  "$id":"https://cacanode.local/contracts/ai-interview/v1/finalized-turn-v1.1.schema.json",
  "title":"Finalized interview turn v1.1",
  "type":"object","additionalProperties":false,
  "required":["schema_version","event_id","event_type","occurred_at","tenant_id","aggregate_id","session_id","call_attempt_id","turn_id","sequence","speaker","turn_kind","section_id","question_id","language_tag","started_at_epoch_ms","ended_at_epoch_ms","transcript","interrupted"],
  "properties":{
    "schema_version":{"const":"1.1"},"event_id":{"type":"string","format":"uuid"},"event_type":{"const":"interview.turn.finalized"},
    "occurred_at":{"type":"string","format":"date-time"},"tenant_id":{"type":"string","format":"uuid"},"aggregate_id":{"type":"string","format":"uuid"},
    "session_id":{"type":"string","format":"uuid"},"call_attempt_id":{"type":"string","format":"uuid"},"turn_id":{"type":"string","format":"uuid"},
    "sequence":{"type":"integer","minimum":1,"maximum":500},"speaker":{"enum":["CANDIDATE","INTERVIEWER","SYSTEM"]},
    "turn_kind":{"enum":["INTRODUCTION","TRANSITION","QUESTION","ACKNOWLEDGEMENT","FOLLOW_UP","CLARIFICATION","REPETITION","SILENCE_PROMPT","CANDIDATE_UTTERANCE","CLOSING"]},
    "section_id":{"type":["string","null"],"format":"uuid"},"question_id":{"type":["string","null"],"format":"uuid"},
    "language_tag":{"enum":["vi-VN","en-US"]},"started_at_epoch_ms":{"type":"integer","minimum":0},"ended_at_epoch_ms":{"type":"integer","minimum":0},
    "transcript":{"type":"string","minLength":1,"maxLength":8000},"interrupted":{"type":"boolean"}
  }
}
