{
  "schema_version":"1.1","event_id":"899b7c9d-8868-5dbe-9999-ed81ed9a65d9","event_type":"interview.turn.finalized","occurred_at":"2026-07-23T08:10:00Z",
  "tenant_id":"aaaaaaaa-aaaa-4aaa-8aaa-aaaaaaaaaaaa","aggregate_id":"22222222-2222-4222-8222-222222222222","session_id":"22222222-2222-4222-8222-222222222222",
  "call_attempt_id":"55555555-5555-4555-8555-555555555555","turn_id":"bf3e5b84-c44b-5e3f-994d-d19bd844cf74","sequence":1,
  "speaker":"CANDIDATE","turn_kind":"CANDIDATE_UTTERANCE","section_id":"77777777-7777-4777-8777-777777777777","question_id":"99999999-9999-4999-8999-999999999999",
  "language_tag":"vi-VN","started_at_epoch_ms":1784794195000,"ended_at_epoch_ms":1784794200000,"transcript":"Tôi đã xây dựng các dịch vụ xử lý sự kiện.","interrupted":false
}
